Название,Год выпуска,Длительность,Описание_перевод,Рейтинг,Страна,Жанр
Отель «Гранд Будапешт»,2014,1h 39m,"Писатель встречает владельца стареющего отеля высокого класса, который рассказывает ему о его первых годах, когда он служил лобби-мальчиком в славные годы отеля под исключительным консьержем.",8.1,"United States, Germany","Adventure, Comedy, Crime"
По соображениям совести,2016,2h 19m,"Медик Американской армии Второй мировой войны Десмонд Т. Досс, служащий во время битвы при Окинаве, отказывается убивать людей и становится первым человеком в американской истории, получившей Медаль Чести, не стреляя в выстрел.",8.1,United States,"Biography, Drama, History"
Исчезнувшая,2014,2h 29m,Муж пропавшей женщины становится главным подозреваемой в ее исчезновении.,8.1,United States,"Drama, Mystery, Thriller"
Воспоминания об убийстве,2003,2h 11m,"В маленькой корейской провинции в 1986 году два детектива борются со случаем того, что многочисленные молодые женщины обнаружили и изнасилованы и убиты неизвестным виновником.",8.1,South Korea,"Crime, Drama, Mystery"
Во имя отца,1993,2h 13m,"Принудительное признание ирландского мужчины к И.Р.А. Бомбардировка он не совершил приводит к тюремному заключению и отца. Тем временем британский адвокат борется, чтобы очистить их имена и освободить их.",8.1,"Ireland, United Kingdom, United States","Biography, Crime, Drama"
Корпорация монстров,2001,1h 32m,"Чтобы питать город, монстры должны пугать детей, чтобы они кричали. Тем не менее, дети токсичны для монстров, и после того, как ребенок пережил, два монстра понимают, что вещи могут не быть тем, что они думают.",8.1,United States,"Animation, Adventure, Comedy"
Рататуй,2007,1h 51m,"Крыса, которая может готовить, составляет необычный союз с молодым кухонным работником в знаменитом парижском ресторане.",8.1,United States,"Animation, Adventure, Comedy"
Золотая лихорадка,1925,1h 35m,"Разведчик отправляется в Клондайк во время золотой лихорадки 1890 -х годов в надежде сделать его состояние, и его поразит девушкой, которую он видит в танцевальном зале.",8.1,United States,"Adventure, Comedy, Drama"
Дикие истории,2014,2h 2m,"Шесть коротких рассказов, которые исследуют конечности человеческого поведения с участием людей в страданиях.",8.1,"Argentina, Spain, France, United Kingdom","Comedy, Drama, Thriller"
Как приручить дракона,2010,1h 38m,"Несчастный молодой викинг, который стремится охотиться на драконов, становится маловероятным другом самого молодого дракона и узнает, что существует больше для существ, чем он предполагал.",8.1,"United States, France, United Kingdom","Animation, Action, Adventure"
Шерлок младший,1924,0h 45m,"Кино -проекционист жаждет стать детективом и ставит свои скудные навыки на работу, когда его создает соперник за кражу карманных часов его подруги.",8.2,United States,"Action, Comedy, Romance"
Челюсти,1975,2h 4m,"Когда массивная убийственная акула развязывает хаос на пляжном сообществе у Лонг -Айленда, она зависит от местного шерифа, морского биолога и старого моряка, чтобы охотиться на зверя.",8.1,United States,"Adventure, Drama, Horror"
Мэри и Макс,2009,1h 32m,В 1976 году в Мельбурне одинокая 8-летняя девочка поднимает переписку с маловероятным приятелем по переписке: 44-летний 44-летний житель Нью-Йорка с синдромом Аспергера.,8.1,Australia,"Animation, Comedy, Drama"
Охотник на оленей,1978,3h 3m,"Углубленное изучение способов, которыми война во Вьетнаме влияет и нарушает жизнь нескольких друзей в маленьком сталелитейном заводе в Пенсильвании.",8.1,"United States, United Kingdom","Drama, War"
Паровоз Генерал,1926,1h 18m,"После того, как его отвергли военные Конфедерации, не осознавая, что это произошло из-за его важнейшей гражданской роли, инженер должен в одиночку повторно вернуть свою любимую локомотиву после того, как он был захвачен союзными шпионами и вернуть его через вражеские линии.",8.1,United States,"Action, Adventure, Comedy"
Ford против Ferrari,2019,2h 32m,"Американский дизайнер автомобилей Кэрролл Шелби и водитель Кен Майлз боятся корпоративное вмешательство и законы физики для строительства революционного гоночного автомобиля для Ford, чтобы победить Ferrari в 24 часа Le Mans в 1966 году.",8.1,United States,"Action, Biography, Drama"
Плата за страх,1953,2h 36m,"В дряхлевой южноамериканской деревне нанимаются четверо мужчин для перевозки неотложной грузоподъемности нитроглицерина без оборудования, которое сделало бы его безопасным.",8.1,"France, Italy","Adventure, Drama, Thriller"
В порту,1954,1h 48m,"Экс-боец, превративший в Нью-Джерси Лонгшореман, изо всех сил пытается противостоять своим коррумпированным боссам Союза, включая своего старшего брата, когда он начинает общаться с скорбящей сестрой одной из жертв синдиката.",8.1,United States,"Crime, Drama, Thriller"
Мистер Смит едет в Вашингтон,1939,2h 9m,"Наивный молодежный лидер назначается для заполнения вакансии в Сенате США. Его идеалистические планы быстро сталкиваются с коррупцией дома и уловками от своего героя в Вашингтоне, но он пытается выходить вперед, несмотря на нападения на своего характера.",8.1,United States,"Comedy, Drama"
Земляничная поляна,1957,1h 32m,"Проживая жизнь, отмеченную холодом, стареющий профессор вынужден противостоять пустоте своего существования.",8.1,Sweden,"Drama, Romance"
Логан,2017,2h 17m,"В будущем, где мутанты почти вымерли, пожилые люди и утомленный Логан ведет тихую жизнь. Но когда Лаура, мутант -ребенок, преследуемый учеными, приходит к нему за помощью, он должен доставить ее в безопасное место.",8.1,United States,"Action, Drama, Sci-Fi"
Третий человек,1949,1h 44m,"Романист из целлюлозы Холли Мартинс путешествует в тенистую, послевоенную Вену, только чтобы расследовать загадочную смерть старого друга Гарри Лайма.",8.1,United Kingdom,"Drama, Film-Noir, Mystery"
Рокки,1976,2h 0m,"Небольшой боксер из Филадельфии получает чрезвычайно редкий шанс сразиться с чемпионом мира в супертяжелом весе, в котором он стремится пройти дистанцию ​​для своего самоуважения.",8.1,United States,"Drama, Sport"
Махараджа,2024,2h 21m,"Парикмахер ищет мести после того, как его дом будет ограблен, загадочно рассказывает полиции, что его «Лакшми» был взят, оставив их неопределенными, если это человек или объект. Его стремление восстановить неуловимую ""Лакшми"" разворачивается.",8.4,India,"Action, Crime, Drama"
Токийская повесть,1953,2h 17m,"Старая пара посещает их детей и внуков в городе, но уделяет мало внимания.",8.1,Japan,Drama
Большой Лебовски,1998,1h 57m,"Джефф ""Чувак"" Лебовски, ошибочный за одноименное миллионера, ищет реституцию за его разрушенный коврик и заполняет своих приятелей для боулинга, чтобы помочь получить его.",8.1,"United Kingdom, United States","Comedy, Crime"
В центре внимания,2015,2h 9m,"Истинная история о том, как Бостонский глобус раскрыл массовый скандал с пристанием к ребенку и прикрытию в местной католической архиепархии, встряхивая всю католическую церковь.",8.1,United States,"Biography, Crime, Drama"
Седьмая печать,1957,1h 36m,"Рыцарь, возвращающийся в Швецию после того, как крестовые походы ищут ответы о жизни, смерти и существовании Бога, когда Он играет в шахмат против мрачного жнеца во время черной чумы.",8.1,Sweden,"Drama, Fantasy"
Терминатор,1984,1h 47m,"Киборгский убийца из будущих попыток найти и убить молодую женщину, которой суждено родить воина, который приведет к сопротивлению спасению человечества от исчезновения.",8.1,"United Kingdom, United States","Action, Adventure, Sci-Fi"
Комната,2015,1h 58m,"Маленький мальчик держит в плену в комнате со своей матерью с момента его рождения, поэтому он никогда не знал мир снаружи.",8.1,"Ireland, Canada, United Kingdom, United States","Drama, Thriller"
Пираты Карибского моря: Проклятие Чёрной жемчужины,2003,2h 23m,"Кузнец будет объединяться с эксцентричным пиратом «капитаном» Джеком Воробей, чтобы спасти Элизабет Суонн, дочь губернатора и его любовь, от бывших пиратских союзников Джека, которые сейчас нежить.",8.1,United States,"Action, Adventure, Fantasy"
Ненависть,1995,1h 38m,24 часа в жизни трех молодых людей во французских пригородах на следующий день после жестокого бунта.,8.1,France,"Crime, Drama"
Да прольётся свет,2021,2h 44m,"Когда племенный мужчина арестован по делу о предполагаемой краже, его жена обращается к адвокату по правам человека, чтобы помочь принести справедливость.",8.7,"India, United States","Crime, Drama"
Отель «Руанда»,2004,2h 1m,"Пол Русесабагина, менеджер отеля, размещает более тысячи беженцев тутси во время их борьбы с милицией хуту в Руанде, Африка.",8.1,"United States, United Kingdom, South Africa, Italy","Biography, Drama, History"
Взвод,1986,2h 0m,"Крис Тейлор, новобранец неофит во Вьетнаме, оказывается пойманным в битве завещания между двумя сержантами, одним добром и другом злом. Проницательное исследование жестокости войны и двойственности человека в конфликте.",8.1,"United States, United Kingdom","Drama, War"
Перед закатом,2004,1h 20m,"Через девять лет после того, как Джесси и Селин впервые встретились, они снова сталкиваются друг с другом на французском этапе книжного тура Джесси.",8.1,"France, United States","Drama, Romance"
Лучшие годы нашей жизни,1946,2h 50m,"Три ветерана Второй мировой войны, два из которых были травмированы или инвалиды, возвращаются домой на американский Средний Запад, чтобы обнаружить, что они и их семьи были непоправимо изменились.",8.1,United States,"Drama, Romance, War"
Изгоняющий дьявола,1973,2h 2m,"Когда таинственная сущность обладает молодой девушкой, ее мать ищет помощи двух католических священников, чтобы спасти ее жизнь.",8.1,United States,Horror
Страсти Жанны д'Арк,1928,1h 50m,В 1431 году Жанна Д'Арк предназначена для суда по обвинению в ересь. Церковные юристы пытаются заставить Жанну отречься от ее требований святых видений.,8.1,France,"Biography, Drama, History"
Волшебник страны Оз,1939,1h 42m,"Молодая Дороти Гейл и ее собака Тото сметают торнадо с их Канзасской фермы на волшебную страну Оз и отправляются на поиски с тремя новыми друзьями, чтобы увидеть волшебника, который может вернуть ее в дом и выполнить пожелания других.",8.1,United States,"Adventure, Family, Fantasy"
Суперсемейка,2004,1h 55m,"Пытаясь вести тихую пригородную жизнь, семья тайных супергероев вынуждена спасти мир.",8.0,United States,"Animation, Action, Adventure"
Звуки музыки,1965,2h 52m,"В 1930 -х годах ее монастырь послал молодой новичок, чтобы стать гувернантой семерыми детьми овдовевшего военно -морского офицера.",8.1,United States,"Biography, Drama, Family"
Гонка,2013,2h 3m,"Джеймс Хант и Ники Лауда, два чрезвычайно опытных гонщика Формулы -1, имеют сильное соперничество друг с другом. Тем не менее, именно их вражда толкает их до предела.",8.1,"United Kingdom, United States","Biography, Drama, Sport"
Хатико: самый верный друг,2009,1h 33m,"Профессор Уилсон обнаруживает потерянного щенка Акиты по дороге домой. Несмотря на возражения со стороны своей жены, Хачи постигает себя семье и становится верным компаньоном Паркера. По мере того, как их связь становится глубже, прекрасные отношения разворачиваются.",8.1,"United Kingdom, United States","Biography, Drama, Family"
Останься со мной,1986,1h 29m,"Писатель рассказывает о детском путешествии со своими друзьями, чтобы найти тело пропавшего мальчика.",8.1,United States,"Adventure, Comedy, Drama"
Телесеть,1976,2h 1m,"Телевизионная сеть цинично использует ненормативные бреды бывшего якоря и откровения о средствах массовой информации для своей собственной прибыли, но обнаруживает, что его сообщение может быть трудно контролировать.",8.1,United States,Drama
Истребитель демонов: Битва в доме Цудзуми,2021,1h 27m,"Танджиро отправляется на юго-юго-восток, где он сталкивается с трусливым молодым человеком по имени Зенитсу Агацума. Он выживший из окончательного отбора, и его воробей просит Танджиро помочь держать его в очереди.",8.5,Japan,"Animation, Action, Fantasy"
Мой отец и мой сын,2005,1h 52m,Семья левого журналиста разрывается после военного переворота Турции в 1980 году.,8.2,Turkey,"Drama, Family"
Служанка,2016,2h 25m,"В 1930 -х годах, Корея, девушка нанимается в качестве служанки японской наследнице, которая живет уединенной жизнью в сельской местности. Но у горничной есть секрет: она - карманник, завербованный мошенником, чтобы помочь соблазнить леди и украсть ее состояние.",8.1,South Korea,"Drama, Romance, Thriller"
Стальной гигант,1999,1h 26m,"Молодой мальчик подружился с гигантским роботом из космоса, который хочет уничтожить параноидный правительственный агент.",8.1,"United States, Czech Republic, United Kingdom","Animation, Action, Adventure"
Быть или не быть,1942,1h 39m,Во время немецкой оккупации Польши действующая труппа становится втянутой в усилия польского солдата по отслеживанию немецкого шпиона.,8.1,United States,"Comedy, Romance, War"
Битва за Алжир,1966,2h 1m,"В 1950 -х годах страх и насилие растут, когда народ Алжира борются за независимость со стороны французского правительства.",8.1,"Italy, Algeria","Drama, War"
В диких условиях,2007,2h 28m,"После окончания Университета Эмори ведущий студент и спортсмен Кристофер МакКандлесс отказывается от своего имущества, придает весь его сберегательный счет в размере 24 000 долларов на благотворительность и автостопные изделия на Аляску, чтобы жить в пустыне.",8.1,United States,"Adventure, Biography, Drama"
Гроздья гнева,1940,2h 9m,"Семья штата Оклахома, изгнанная с фермы по бедности и безнадежности пылевой чаши, присоединяется к миграции на запад в Калифорнию, страдая от несчастий бездомных в Великой депрессии.",8.1,United States,Drama
День сурка,1993,1h 41m,"Нарциссический, эгоистичный метеоролог оказывается в временной цикле в день сурка.",8.0,United States,"Comedy, Drama, Fantasy"
Форма голоса,2016,2h 10m,"Глухая девушка, Шоко, издевается популярной Шайей. Когда Шоя продолжает запугать Шоко, класс возвращается на него. Шоко переводится, а Shoya растет как изгоя. В одиночку и в депрессии, сожаление Шая находит Шоко, чтобы исправить.",8.1,Japan,"Animation, Drama"
Прислуга,2011,2h 26m,"Начинающий автор во время движения за гражданские права 1960 -х годов решает написать книгу, в которой подробно описывается точка зрения афроамериканских горничных на белых семьях, для которых они работают, и трудности, которые они проходят ежедневно.",8.1,"United States, India",Drama
Сука любовь,2000,2h 34m,"Любительский боец ​​собаки, супермодель и заброшенная убийца, все они изо всех сил пытаются найти любовь, находят свою жизнь, преобразованную разрушительной автомобильной аварией в Мехико.",8.0,Mexico,"Drama, Thriller"
Ребекка,1940,2h 10m,Самосознательная женщина жонглирует приспособленной к своей новой роли жены аристократа и избегая запугивания спектрального присутствия его первой жены.,8.1,United States,"Drama, Mystery, Romance"
Видимость,2015,2h 43m,"Отчаянные меры принимаются человеком, который пытается спасти свою семью от темной стороны закона, после того, как они совершили неожиданное преступление.",8.2,India,"Crime, Drama, Mystery"
