Название,Год выпуска,Длительность,Описание_перевод,Рейтинг,Страна,Жанр
Волк с Уолл-стрит,2013,3h 0m,"Основываясь на истинной истории Джордана Белфорта, от его подъема до богатого фондового брокера, проживающего высокую жизнь до его падения, связанного с преступностью, коррупцией и федеральным правительством.",8.2,United States,"Biography, Comedy, Crime"
Бэтмен: Начало,2005,2h 20m,"Свидев смерть своих родителей, миллиардер Брюс Уэйн узнает искусство борьбы, чтобы противостоять несправедливости. Когда он возвращается в Готэм в роли Бэтмена, он должен остановить секретное общество, которое намеревается уничтожить город.",8.2,"United States, United Kingdom","Action, Drama"
Зеленая книга,2018,2h 10m,Итальянско-американский вышибала рабочего класса становится движущей силой афроамериканского классического пианиста в туре по местам по американскому югу 1960-х годов.,8.2,"United States, China","Biography, Comedy, Drama"
На несколько долларов больше,1965,2h 12m,"Два убийцы наградных с аналогичными намерениями, но различные мотивы объединяются, чтобы выследить психотический мексиканский преступник, прежде чем он и его банда смогут выполнить смелое ограбление банка.",8.2,"Italy, Spain, West Germany","Drama, Western"
Шоу Трумана,1998,1h 43m,"Продавец страхования начинает подозревать, что вся его жизнь на самом деле является своего рода реалити -шоу.",8.2,United States,"Comedy, Drama"
Нюрнбергский процесс,1961,2h 59m,"Художественное изображение судей 1947 года, третье из двенадцати судебных процессов нацистских военных преступников, проведенных американскими оккупационными силами в Нюрнберге, Германия, в которых бывшие судьи нацистской Германии были предприняты для их действий.",8.3,United States,"Drama, War"
В джазе только девушки,1959,2h 1m,"После того, как два музыканта-мужчины стали свидетелями хита толпы, они бежат от государства в группе, замаскированной как женщины, замаскированной как женщины, но возникают дальнейшие осложнения.",8.2,United States,"Comedy, Music, Romance"
Малыш,1921,1h 8m,"Бродяга заботится о брошенном ребенке, но события подвергают их отношениям их отношения.",8.2,United States,"Comedy, Drama, Family"
Остров проклятых,2010,2h 18m,"Два американских маршала отправляются в психиатрическое учреждение на негостеприимном острове, чтобы исследовать исчезновение пациента.",8.2,United States,"Drama, Mystery, Thriller"
Отец,2020,1h 37m,"Мужчина отказывается от всей помощи от своей дочери, когда он стареет. Когда он пытается понять, что происходит вокруг него, он начинает сомневаться в своих близких, его собственном уме и даже ткани его реальности.",8.2,"United Kingdom, France, United States","Drama, Mystery"
Всё о Еве,1950,2h 18m,"Казалось бы, робкая, но тайно безжалостная Инжене вмешается в жизнь стареющей звезды Бродвея и ее круга театральных друзей.",8.2,United States,Drama
Парк юрского периода,1993,2h 7m,"Промышленник приглашает некоторых экспертов посетить его тематический парк клонированных динозавров. После сбоя сил существа убегают, впадая в опасность, в том числе его внуки.",8.2,United States,"Action, Adventure, Sci-Fi"
Нефть,2007,2h 38m,"История семьи, религии, ненависти, нефти и безумия, сосредоточенная на разведчике на рубеже веков в первые дни бизнеса.",8.2,United States,Drama
Казино,1995,2h 58m,"В Лас-Вегасе два лучших друзья-исполнительный директор казино и мафиозный сияющий-скомплектируются империей азартных игр и быстроживущем, быстро любящем светском происхождении.",8.2,"United States, France","Crime, Drama"
Шестое чувство,1999,1h 47m,"После того, как его застрелил бывшим пациентом, которого он не смог помочь, детский психолог из Филадельфии ищет искупления, обращаясь к молодому мальчику с тревожным секретом.",8.2,United States,"Drama, Mystery, Thriller"
Ран,1985,2h 40m,"В средневековой Японии пожилой военачальник уходит на пенсию, передавая свою империю своим трем сыновьям. Тем не менее, он значительно недооценивает, как вновь обретенная сила испортит их, и заставит их поворачивать друг друга ... и его.",8.2,"Japan, France","Action, Drama, War"
Топ Ган. Мэверик,2022,2h 10m,"История связана с тем, что Маверик противостоит своему прошлому во время обучения группы молодых выпускников высшего оружия, в том числе сына его покойного лучшего друга, для опасной миссии.",8.2,United States,"Action, Drama"
Старикам тут не место,2007,2h 2m,"Насилие и хаос заступают после того, как охотник наткнулся на последствия сделки с наркотиками, и более двух миллионов долларов наличными возле Рио -Гранде.",8.2,United States,"Crime, Drama, Thriller"
Нечто,1982,1h 49m,"Исследовательская группа в Антарктиде охотится на инопланетянин, изменяющий форму, который предполагает появление своих жертв.",8.2,"United States, Canada","Horror, Mystery, Sci-Fi"
Лабиринт Фавна,2006,1h 58m,"В 1944 году Испания послала девушку жить со своим безжалостным отчимом. Ночью она встречает фею, которая ведет ее к старому фаун. Он говорит ей, что она принцесса, но должна доказать свою королевскую власть, пережив три ужасных задачи.",8.2,"Mexico, Spain","Drama, Fantasy, War"
Непрощенный,1992,2h 10m,"Острый Уэст -Уэст -Ганслингер в отставке неохотно берет на себя последнюю работу, чтобы отомстить за несправедливость с помощью своего старого партнера и более нового преступника, известного просто как ребенок Шофилда.",8.2,United States,"Drama, Western"
Игры разума,2001,2h 15m,"Математический гений, Джон Нэш сделал удивительное открытие в начале своей карьеры и стоял на грани международного признания. Но красивый и высокомерный Нэш вскоре оказался в душераздирающем путешествии самопознания.",8.2,United States,"Biography, Drama, Mystery"
Убить Билла. Фильм 1,2003,1h 51m,"Проснувшись от четырехлетней комы, бывший убийца отомстил от команды убийц, которые ее предали.",8.2,United States,"Action, Crime, Thriller"
Сокровища Сьерра Мадре,1948,2h 6m,"Два американца в духе, ищущие работу в 1920-х годах Мексики, убедили старого разведчика помочь им добывать золото в горах Сьерра-Мадре.",8.2,United States,"Adventure, Drama, Western"
Пленницы,2013,2h 33m,"Келлер Дувер сталкивается с худшим кошмаром каждого родителя. Его шестилетняя дочь, Анна, пропала без вести, вместе со своей подругой Джой, и, когда минуты превращаются в часы, панические зарегистрируются. Единственное лидерство-это RV, который был припаркован на их улице.",8.2,United States,"Crime, Drama, Mystery"
Телохранитель,1961,1h 50m,"Хитрый Ронин приходит в город, разделенный двумя преступными бандами, и решает сыграть их друг против друга, чтобы освободить город.",8.2,Japan,"Action, Drama, Thriller"
В поисках Немо,2003,1h 40m,"После того, как его сын запечатлен в Большом Барьерном рифе и доставлен в Сидней, робкая рыба -клоуна отправляется в путешествие, чтобы привести его домой.",8.2,"United States, Japan","Animation, Adventure, Comedy"
Большой побег,1963,2h 52m,"Союзные офицеры в немецком лагере военнопленного во время Второй мировой войны создают смелый план массового побега сотнями своих людей, надеясь вытащить немецкий персонал и ресурсы вдали от боевых операций.",8.2,United States,"Adventure, Drama, Thriller"
Монти Пайтон и священный Грааль,1975,1h 31m,"Король Артур и его рыцари круглого стола отправляются в сюрреалистический, малобюджетный поиск Святого Грааля, встречающего много, очень глупые препятствия.",8.2,United Kingdom,"Adventure, Comedy, Fantasy"
Ходячий замок,2004,1h 59m,"Когда неуверенная молодая женщина проклята старым телом злобной ведьмой, ее единственный шанс нарушить заклинание лежит с самодовольным, но небезопасным молодым волшебником и его спутниками в его ноже, ходячий замок.",8.2,"Japan, United States","Animation, Adventure, Family"
The Elephant Man,1980,2h 4m,"Викторианский хирург спасает сильно изуродованного человека, которому плохо обращается, когда собираясь на жизнь как урод с боковым шоу. За его чудовищным фасадом обнаружен человек доброты, интеллекта и изысканности.",8.2,"United States, United Kingdom","Biography, Drama"
В случае убийства набирайте «М»,1954,1h 45m,"Лондонский плейбой представляет идеальное убийство его богатой, неверной жены.",8.2,United States,"Crime, Drama, Mystery"
Унесённые ветром,1939,3h 58m,"Закрытая и манипулятивная южная Белль и рогусский спекулятор сталкиваются с турбулентным романом, когда общество вокруг них рушатся с концом рабства и восстанавливается во время гражданской войны и периодов реконструкции.",8.2,United States,"Drama, Romance, War"
Расёмон,1950,1h 28m,"Изнасилование невесты и убийство ее мужа -самураев вспоминаются с точек зрения бандита, невесты, призрака самураев и деревянного штампа.",8.2,Japan,"Crime, Drama, Mystery"
Клаус,2019,1h 36m,"Простой акт доброты всегда вызывает другой, даже в замороженном, далеком месте. Когда новый почтальон Смиеренсбурга, Джеспер, подружился с игрушками Клауса, их подарки растают вековую вражду и доставляют сами, полные праздничных традиций.",8.2,"Spain, United Kingdom, United States, Austria, Canada, France","Animation, Adventure, Comedy"
Я все еще здесь,2024,2h 17m,"Женщина вышла замуж за бывшего политика во время военной диктатуры в Бразилии, вынуждена заново изобретать себя и наметить новый курс для своей семьи после насильственного и произвольного акта.",8.4,"Brazil, France","Biography, Drama, History"
Китайский квартал,1974,2h 10m,"Частный детектив, нанятый для разоблачения прелюбодея в 1930 -х годах, Лос -Анджелес оказывается в том, что он попал в сеть обмана, коррупции и убийства.",8.1,United States,"Drama, Mystery, Thriller"
Тайна в его глазах,2009,2h 9m,"Отставной юрисконсульт пишет роман в надежде найти закрытие для одного из его прошлых неразрешенных дел об убийстве, а также за его неразрешившую любовь к его начальнику - оба из которых все еще преследуют его десятилетия спустя.",8.2,"Argentina, Spain","Drama, Mystery, Romance"
"Карты, деньги, два ствола",1998,1h 47m,"Когда четыре мелких преступника проигрывают сфальсифицированную игру в покер против лондонского короля, он дает им одну неделю, чтобы урегулировать их огромный долг.",8.1,"United Kingdom, United States","Comedy, Crime"
«V» значит Вендетта,2005,2h 12m,"В будущем Британском антиутопическом обществе, темный боец ​​свободы, известный только псевдонимом «V», предназначен для свержения тиранического правительства - с помощью молодой женщины.",8.1,"United States, United Kingdom, Germany","Action, Drama, Sci-Fi"
Головоломка,2015,1h 35m,"После того, как молодая Райли вырвана из своей жизни на Среднем Западе и переехала в Сан -Франциско, ее эмоции - радость, страх, гнев, отвращение и грусть - конфликт с тем, как лучше всего ориентироваться в новом городе, доме и школе.",8.1,United States,"Animation, Adventure, Comedy"
Дикий робот,2024,1h 42m,"После кораблекрушения умный робот под названием Роз оказался на необитаемом острове. Чтобы выжить в суровой среде, Роз связывается с животными острова и заботится о детском гусь с сиротом.",8.2,"United States, Japan","Animation, Sci-Fi"
"Три билборда на границе Эббинга, Миссури",2017,1h 55m,"Мать лично бросает вызов местным властям раскрыть убийство своей дочери, когда они не могут поймать виновника.",8.1,"United Kingdom, United States","Comedy, Crime, Drama"
Мост через реку Квай,1957,2h 41m,"Британские военнопленные вынуждены построить железнодорожный мост через реку Кваи для своих японских похитителей в оккупированной Бирме, не зная, что союзные силы планируют смелый набег на коммандос через джунгли, чтобы уничтожить его.",8.1,"United Kingdom, United States","Adventure, Drama, War"
На игле,1996,1h 33m,"Рентон, глубоко погруженный на сцену наркотиков в Эдинбурге, пытается убрать и выйти, несмотря на очарование наркотиков и влияние друзей.",8.1,"United Kingdom, United States",Drama
Бешеный бык,1980,2h 9m,"Жизнь боксера Джейка Ламотты, чье насилие и характер, которые привели его к вершине на ринге, разрушила его жизнь вне его.",8.1,United States,"Biography, Drama, Sport"
"Поймай меня, если сможешь",2002,2h 21m,"Еще 17 еще 17, Фрэнк - опытный фальсификатор, который прошел в качестве врача, адвоката и пилота. Агент ФБР Карл становится одержимым отслеживанием мошенника, который только наслаждается преследованием.",8.1,"United States, Canada","Biography, Crime, Drama"
Фарго,1996,1h 38m,"Продавец автомобилей Миннесоты Джерри Ландегаард непредубеляется из -за того, что он и его приспешники сражаются и постоянную полицейскую работу довольно беременной Мардж Гандерсон.",8.1,"United Kingdom, United States","Crime, Drama, Thriller"
Воин,2011,2h 20m,"Младший сын бывшего боксера -алкоголика возвращается домой, где он обучен своим отцом для соревнований в турнире по смешанным боевым искусствам - пути, который ставит бойца на курс столкновения со своим отчужденным старшим братом.",8.1,United States,"Action, Drama, Sport"
Гарри Поттер и Дары смерти: Часть II,2011,2h 10m,"По мере того, как битва между силами добра и зла в волшебном мире экранируется, Гарри Поттер приближается к своему последнему противостоянию с Волдемортом.",8.1,"United Kingdom, United States","Adventure, Family, Fantasy"
Гран Торино,2008,1h 56m,"После того, как подросток хмонга пытается украсть свой ценный Gran Torino 1972 года, недовольный, предвзятый ветеран Корейской войны стремится искупить и мальчика, и его себя.",8.1,"Germany, United States",Drama
Малышка на миллион,2004,2h 12m,"Фрэнки, злоупотребленный старым тренером, неохотно соглашается обучить начинающего боксера Мэгги. Впечатленная ее решимостью и талантом, он помогает ей стать лучшей, и они вскоре составляют тесную связь.",8.1,United States,"Drama, Sport"
Мой сосед Тоторо,1988,1h 26m,"Когда две девушки переезжают в страну, чтобы быть рядом с своей больной матерью, у них есть приключения с чудесными лесными духами, которые живут поблизости.",8.1,Japan,"Animation, Comedy, Family"
Человек-паук: Нет пути домой,2021,2h 28m,"Теперь, когда личность Человека-паука раскрыта, Питер просит доктора Стрэнджа о помощи. Когда заклинание идет неправильно, начинают появляться опасные враги из других миров.",8.2,United States,"Action, Adventure, Fantasy"
Безумный Макс: Дорога ярости,2015,2h 0m,"В постсапокалиптической пустоши женщина повстанцает против тиранического правителя в поисках своей родины с помощью группы женских заключенных, психотического поклонника и дрифтера по имени Макс.",8.1,"Australia, United States","Action, Adventure, Sci-Fi"
Бен-Гур,1959,3h 32m,"Еврейский принц предан и отправлен в рабство римским другом в Иерусалиме 1-го века, но вскоре он восстановит свою свободу и вернется за мести.",8.1,United States,"Adventure, Drama"
Дети небес,1997,1h 29m,"После того, как мальчик теряет пару туфель своей сестры, он отправляется в серию приключений, чтобы найти их. Когда он не может, он пробует новый способ «выиграть» новую пару.",8.2,Iran,"Drama, Family, Sport"
Барри Линдон,1975,3h 5m,Ирландский мошенник выигрывает сердце богатой вдовы и занимает аристократическую должность ее мертвого мужа в Англии 18-го века.,8.1,"United Kingdom, United States","Adventure, Drama, War"
12 лет рабства,2013,2h 14m,"В антебеллуме Соломон Нортуп, свободный черный человек из северной части штата Нью -Йорк, похищен и продается в рабство.",8.1,"United Kingdom, United States","Biography, Drama, History"
Перед рассветом,1995,1h 41m,"Молодой мужчина и женщина встречаются в поезде в Европе, и однажды вечером проводят вместе в Вене. К сожалению, оба знают, что это, вероятно, будет их единственной ночью вместе.",8.1,"United States, Austria","Drama, Romance"
Общество мёртвых поэтов,1989,2h 8m,"Учитель Маверика Джон Китинг возвращается в 1959 году в престижную школу-интернат в Новой Англии, где он когда-то был звездным учеником, используя поэзию, чтобы побудить своих учеников к новым высотам самовыражения.",8.1,United States,"Comedy, Drama"
Бегущий по лезвию,1982,1h 57m,"Бегущий по лезвию должен преследовать и прекратить четыре репликанта, которые украли корабль в космосе и вернулись на Землю, чтобы найти своего создателя.",8.1,"United States, United Kingdom","Action, Drama, Sci-Fi"
